query,contexts
 How have Karun Nair and Aditya Sarwate adapted to their new team environments after moving from their previous teams?,"2: Both Karun Nair and Aditya Sarwate have adapted well to their new team environments despite being considered outsiders. Karun Nair, originally from Karnataka, seamlessly adjusted to Vidarbha's team culture with the help of familiar connections and the common language, Hindi. His past experiences and the camaraderie he developed have been reflected in his performances. Aditya Sarwate, though facing a potential language barrier in Kerala, connected with teammates through English and Hindi, alongside the friendship with Jalaj Saxena. His commitment and performance underlined his seamless integration into the Kerala team, as evidenced by his crucial contributions."
" How has Shubman Gill performed in recent international cricket tournaments, according to the article?","1: Shubman Gill has been exceptional in recent ODI tournaments, having scored a century in India's Champions Trophy opener against Bangladesh and a brisk 46 against Pakistan. His performance has contributed significantly to India's success at the top of the order."
" What accomplishment has Shubman Gill achieved in the ICC ODI rankings, as highlighted in the article?","2: Shubman Gill has dethroned Babar Azam from the top spot in the ICC ODI rankings. In the latest rankings list, Gill has 796 rating points, surpassing Babar Azam's 773. This achievement underscores his dominance and consistency in the ODI format."
 Why is Vidarbha not taking Kerala lightly in the Ranji Trophy final despite being considered the favorites?,"1: Vidarbha is not taking Kerala lightly in the Ranji Trophy final because they recognize Kerala’s ability to win close matches and their experience. Vidarbha acknowledges Kerala's unbeaten record at the Jamtha Stadium, the venue for the final, and understands that Kerala has reached the final through resilience, playing some close matches and winning away from home. Vidarbha's captain, Akshay Wadkar, emphasizes the importance of being aware of their limitations and the dangers posed by a determined and experienced opponent like Kerala."
" What factors contribute to Vidarbha’s perceived advantage over Kerala, and how has their cricketing philosophy evolved over time?","2: Vidarbha's perceived advantage over Kerala lies in their dominant season performance, marked by eight wins out of nine matches, and a more equitable distribution of wicket-taking responsibilities among bowlers. Vidarbha's cricketing philosophy has evolved by learning from their limitations, shifting from relying on borrowed talent to nurturing home-grown players like Harsh Dubey and Yash Rathod. This maturity in recognizing weaknesses while leveraging strengths reflects their journey from a cricketing wilderness to a formidable side, capable of winning crucial matches under pressure."
 Why is Venkatesh Iyer's name being associated with the captaincy of Kolkata Knight Riders for IPL 2025?,"1: Venkatesh Iyer's name is being associated with the captaincy of Kolkata Knight Riders for IPL 2025 because the team let go of their title-winning skipper Shreyas Iyer, leading to speculation about his potential to take over the role given his experience and recent re-purchase by the team for a significant price of Rs 23.75 crore."
 How does Venkatesh Iyer view leadership and captaincy in cricket?,"2: Venkatesh Iyer views leadership as being more significant than the formal title of captaincy. He believes that one can be a leader by setting examples and being a good role model both on and off the field. He emphasizes the importance of providing an environment where everyone feels free to express their opinions and contribute to the team, regardless of their experience or salary."
 What reasons did Sunil Gavaskar give for Pakistan's current struggles in cricket compared to India's success?,"1: Sunil Gavaskar suggested that Pakistan's current struggles in cricket could be attributed to their lack of bench strength, despite having natural talent in the past. He highlighted that Pakistan has failed to produce match-winners even with the presence of the Pakistan Super League. In contrast, India has successfully produced many young stars in white-ball cricket, largely due to the Indian Premier League (IPL), which has provided a platform for players to develop their skills and progress to play in the Ranji Trophy and ultimately for the national team."
" How has Pakistan's performance been in recent ICC tournaments, and what was their best result?","2: Since the 2017 World Cup, Pakistan has struggled in ICC tournaments. Their best performance came in the 2022 T20 World Cup, where they reached the final but ended up losing. In addition, they have finished fifth in the last two ODI World Cups and have not been able to reach any World Test Championship final."
" What is the current standing of Gujarat Giants in the Women’s Premier League 2025, and who is their standout performer this season?","1: Gujarat Giants are currently stuck in the last position in the Women’s Premier League 2025. Their standout performer this season has been Australian all-rounder Ashleigh Gardner, who has been doing most of the heavy lifting for the team and is the third highest run-getter with 141 runs."
" Who are the key players for Delhi Capitals mentioned in the article, and what has been their performance so far?","2: The key players for Delhi Capitals mentioned in the article are Shafali Verma, Meg Lanning, Jemimah Rodrigues, and Annabel Sutherland. They have shown glimpses of form during the season but have not been consistent in their performances, contributing to the team slipping to third place after their loss to UP Warriorz."
 What was Sana Mir's main criticism regarding the Pakistan cricket team's performance in the Champions Trophy?,"1: Sana Mir criticized the Pakistan cricket team for their poor performance, asserting that even appointing legendary captains like MS Dhoni or Younis Khan wouldn't change the team's fortunes because the squad was not selected based on the playing conditions. She emphasized that the 15-member squad was poorly chosen, as it did not align with the requirements of the tournament's venues, which included a match in Dubai that necessitated the inclusion of more suitable spinners."
" According to Sana Mir, how did the selection committee's decisions impact the team's performance in the Champions Trophy?","2: Sana Mir pointed out that the selection committee's decision negatively impacted the team's performance by failing to choose players based on match conditions. She noted that the committee omitted key players who had been successful in recent series against Australia and South Africa and instead included part-time spinners who were ineffective in such crucial matches. This misjudgment, according to Mir, resulted in Pakistan effectively losing half the tournament when the squad was announced."
 What are the current challenges faced by the England team in their match against Afghanistan in the Champions Trophy 2025?,"1: England is facing challenges with the form of opener Phil Salt and middle-order batsman Harry Brook. Phil Salt has struggled to convert his starts into significant scores since his hundred in 2022, often getting out after scoring quick 30s or 40s. Similarly, Harry Brook, despite his impressive performances in home ODIs against Australia last year, has not been in the best form recently. Additionally, England's recent performances against spin bowlers have been inconsistent, which could pose difficulties against Afghanistan's spin attack comprised of Rashid Khan, Noor Ahmad, and Mohammad Nabi."
" What are the expected weather conditions and pitch characteristics for the England vs Afghanistan match at Gaddafi Stadium, Lahore?","2: The weather forecast for Lahore on the day of the England vs Afghanistan match indicates a clear day with no expected rain, and the temperature will remain in the 20s throughout the game. The pitch at Gaddafi Stadium is generally known to favor batsmen, and the presence of dew, particularly in the second innings, could make it difficult for bowlers to grip the ball, providing an advantage to the batting side. This may influence teams winning the toss to choose to chase."
 What advantage does Pat Cummins believe India has in the ongoing Champions Trophy?,"1: Pat Cummins believes India has a ""huge advantage"" because all their Champions Trophy games are played at the Dubai International Cricket Stadium, avoiding the need to travel. In contrast, other countries have to travel around Pakistan for their group games."
" Why is Pat Cummins missing from the Champions Trophy, and what has he been focusing on in his absence?","2: Pat Cummins is missing from the Champions Trophy to stay at home for the birth of his second child and to rest a niggling ankle injury. During his absence, he is spending valuable time with his family and working on his recovery, with plans to start running and bowling soon."
 What did Michael Atherton say about the current state of the India vs Pakistan cricket rivalry?,"1: Michael Atherton stated that the rivalry between India and Pakistan has become ""one-sided"" as the hype didn't match the expectations. He mentioned that India defeated Pakistan by six wickets in their recent encounter and argued that Pakistan's batting lacked energy and dynamism. Atherton pointed out that despite the high anticipation for these matches, especially due to their rarity, the results have been predictably in favor of India, with Pakistan only winning once in their last nine ODI encounters over the past 10 years."
 How does Michael Atherton's view on the current India vs Pakistan rivalry compare to their historical performance since 2000?,"2: Michael Atherton noted that while the India vs Pakistan rivalry is currently one-sided in India's favor over the last 10 years, historically, since the start of 2000, Pakistan has been more competitive against India in ODIs. He mentioned that Pakistan has won 26 matches and lost 30 matches against India during that period, indicating a more balanced competition compared to the recent one-sided outcomes."
 How did Virat Kohli's recent achievement against Pakistan in the Champions Trophy emphasize his stature in ODI cricket?,"1: Virat Kohli's performance against Pakistan in the ongoing Champions Trophy highlighted his status in ODI cricket by becoming the fastest player to reach 14,000 ODI runs and being only the third cricketer to achieve this milestone. He led the chase, scoring an unbeaten 100 and finishing the match for India with a boundary, showcasing his mastery in run chases."
 What comparisons did Nasser Hussain and Michael Atherton make about Virat Kohli and other cricketing legends in ODIs?,"2: Nasser Hussain and Michael Atherton compared Virat Kohli to cricketing legends like Sachin Tendulkar and Kumar Sangakkara, highlighting his faster achievement of 14,000 ODI runs in fewer innings than both. They suggested that while there are several great ODI players like Tendulkar, Kumar Sangakkara, and AB de Villiers, Kohli's statistics and performances place him at the top of the list in ODI history."
 Why do Nasser Hussain and Michael Atherton believe India has an advantage in the Champions Trophy by playing in Dubai?,"1: Nasser Hussain and Michael Atherton believe India has an advantage in the Champions Trophy by playing all their matches in Dubai because they don't have to travel between venues or countries, unlike other teams. This allows them to focus on the specific conditions of a single venue and optimize their selection accordingly. Additionally, staying in one place provides familiarity with the pitches and consistent use of the same facilities, giving them a comfortable and strategic edge."
 What strategic decisions have India made to maximize their advantage in playing all matches in Dubai?,"2: India has been smart in their team selection by including five spinners, understanding that the conditions in Dubai favor spin bowling. This strategic choice contrasts with some other teams like England and Pakistan, who have fewer spinners. India's selection aligns with their knowledge of the pitch conditions, allowing them to optimize their gameplay without the need to adjust to varying conditions across different venues."
 What are the weather conditions expected for the Australia vs South Africa match in Rawalpindi?,"1: The weather conditions for the Australia vs South Africa match in Rawalpindi are expected to include a significant chance of rain, with predictions ranging from 50% to 70% probability. The temperature is expected to hover around 15 degrees Celsius, ranging from 14 to 24 degrees Celsius. The high likelihood of rain could potentially disrupt the match."
" How does the Rawalpindi pitch historically perform in ODI matches, and what could teams expect during the Australia vs South Africa game?","2: The Rawalpindi pitch is generally known for being batting-friendly, with a flat surface that offers good bounce and pace, making high scores common. However, as the game progresses, the pitch tends to slow down, allowing spinners to find good turn and variable bounce. The potential for dew and the batting-friendly nature of the pitch could lead the team winning the toss to prefer fielding first as high scores have been chased down in recent ODI games at this venue."
 When and where will the AUS vs SA match at the Champions Trophy 2025 take place?,"1: The Champions Trophy 2025 match between Australia and South Africa will be held on Tuesday, February 25 at the Rawalpindi Cricket Stadium, Rawalpindi."
 Where can viewers in India watch the live telecast and live stream of the AUS vs SA Champions Trophy 2025 match?,"2: In India, the live telecast of the Australia vs South Africa Champions Trophy 2025 match will be aired on the Star Sports and Sports18 channels. The match can also be live-streamed on the JioHotstar app and website."
 Why is Heinrich Klaasen missing the match against Australia in the Champions Trophy 2025?,1: Heinrich Klaasen is missing the match against Australia due to an elbow injury that also caused him to miss South Africa's opener against Afghanistan.
 What recent performances by Australian players might give them confidence against South Africa despite missing key players?,"2: Josh Inglis' century and half-centuries by Matthew Short and Alex Carey against England might give Australia confidence heading into the match against South Africa, despite missing key players like Pat Cummins, Mitchell Starc, Mitchell Marsh, and Josh Hazlewood."
 What aspects of Shubman Gill's batting impressed Javed Miandad and R Ashwin?,"1: Javed Miandad was impressed by Shubman Gill's use of his wrists, particularly how he powers the ball and gives it direction by snapping his wrists. R Ashwin highlighted Gill's smart use of his hands and feet, particularly his ability to adjust his movements in anticipation of the bowler's delivery. Ashwin noted Gill's readiness for a short pull shot and subsequent adaptation to flick the ball away, demonstrating his strategic thinking and adaptability."
" How does Shubman Gill's positive intent influence his batting performance, and why is it crucial for India?","2: Shubman Gill emphasizes thinking with positive intent, which he believes is crucial for his performance. This mindset prevents him from becoming overly defensive, allowing him to seize key moments in the game, as seen in his proactive efforts against bowlers like Shaheen Afridi. His positive intent is vital for India as it allows him to effectively counter opponents' new-ball strategies and maintain the momentum of gameplay, especially in the absence of senior players like Rohit Sharma."
" What were the key factors behind Bangladesh and Pakistan's elimination from the ICC Champions Trophy, as discussed in the article?","1: The article highlights several factors behind the elimination of Bangladesh and Pakistan from the ICC Champions Trophy. Notably, both teams showed a lack of urgency and desperation in their must-win matches. Bangladesh struggled to capitalize on a decent start against New Zealand, with their batsmen failing to find the gaps for singles and relying heavily on occasional big shots. Additionally, Bangladesh allowed New Zealand's Michael Bracewell to bowl 10 consecutive overs, during which he took four key wickets, reflecting a passive approach. Despite playing on spin-friendly pitches back home, Bangladesh appeared unprepared for even the disciplined bowling from New Zealand. Pakistan's approach in their games was similarly ineffective, and neither team adapted well to the demands of modern limited-overs cricket."
 How did New Zealand's performance contribute to their progression to the ICC Champions Trophy semifinals?,"2: New Zealand's performance was characterized by a well-drilled and adaptable team approach, which contributed significantly to their progression to the semifinals. In their match against Bangladesh, Rachin Ravindra was pivotal, scoring a classy 112 off 104 balls and forming a crucial 129-run partnership with Tom Latham. The team showed a consistent ability to maintain the run rate by adeptly rotating strike and finding boundary options. New Zealand's bowlers, including Michael Bracewell's disciplined performance, effectively restricted the opposition despite bowling on a pitch that offered little turn. The Kiwis have demonstrated depth and adaptability in their squad, with different players stepping up in crucial moments, even when key batsmen like Kane Williamson haven't contributed significantly. Their strategic approach and consistent performance exemplify why they remain a habitual presence in the latter stages of major tournaments."
 What are some key factors contributing to Pakistan's poor performance in the recent ICC Champions Trophy?,"1: Pakistan's poor performance in the recent ICC Champions Trophy can be attributed to a number of factors, including frequent changes in the team management and leadership roles, with 26 different selectors, 8 coaches, and 4 captains in the last three years. Additionally, structural issues within the cricket system, lack of consistent talent, and unsuccessful strategic decisions like last-minute team changes have contributed to their underwhelming performance. The team has also struggled with ineffective execution of bowling plans despite having fast bowlers capable of high speeds."
 How has the lack of continuity and strategic planning affected Pakistan's cricket team in the Champions Trophy?,"2: The lack of continuity and strategic planning has significantly affected Pakistan's cricket team in the Champions Trophy by preventing the establishment of a cohesive and settled team structure. The disruption caused by frequent changes in key roles, such as the head coach and captain, undermines the team's ability to develop a consistent playing strategy. Moreover, last-minute team alterations and mismanagement in player selection have hurt the team's performance, contributing to their early exit from the tournament despite substantial investments in infrastructure and preparation for hosting the event."
 What criticism did Wasim Akram levy against the Pakistan pace bowling trio during the ICC Champions Trophy match against India?,"1: Wasim Akram criticized the Pakistan pace bowling trio, comprising Shaheen Shah Afridi, Haris Rauf, and Naseem Shah, for their poor performance, highlighting their high bowling averages nearing 50. He mentioned that Shaheen Afridi had an average of 43, Haris Rauf an average of 52, and Naseem Shah an average of 56. He expressed that with such high averages, Pakistan is unlikely to win games."
 What suggestions did Waqar Younis provide regarding improving Pakistan cricket's performance in the future?,"2: Waqar Younis suggested that Pakistan cricket needs 'surgery' to regain its past glory. He indicated that the improvement should be strategic, identifying players capable of playing modern cricket and making changes without drastic measures like 'open heart surgery.' He advocated for giving opportunities to promising young players, aligning with Wasim Akram's view, and acknowledging that restoring the team's performance will take time."
 What was significant about Virat Kohli's 51st ODI hundred against Pakistan in the Champions Trophy?,"1: Virat Kohli's 51st ODI hundred against Pakistan was significant because it was his first international hundred since scoring against Australia in the Perth Test match during the Border-Gavaskar Trophy in Australia. Additionally, during this match, Kohli surpassed the 14,000 run mark in ODI cricket, making him the third player after Sachin Tendulkar and Kumar Sangakkara to achieve this milestone, and he did so in fewer innings than either of those cricket legends."
" How did Ravichandran Ashwin view Virat Kohli's recent form, particularly in ODI cricket?","2: Ravichandran Ashwin expressed strong faith in Virat Kohli's quality as a player, emphasizing that there should not be doubts about Kohli's abilities despite criticisms during the Test matches in Australia. Ashwin described ODI cricket as Kohli's ""engine room"" and suggested that Kohli's performance in this format could signify his ""second coming,"" likely boosting his confidence. Ashwin praised Kohli's stellar knock against Pakistan and highlighted his cover drive as a standout element of his batting prowess."
" How did Kuldeep Yadav perform in the Champions Trophy match against Pakistan after his comeback, and what comments did Ravichandran Ashwin make about his performance?","1: Kuldeep Yadav took three crucial wickets in the Champions Trophy match against Pakistan, marking his best wicket haul in his last four matches since returning from a sports hernia injury. Ravichandran Ashwin praised Yadav, stating that he has a ""miracle in his hands"" and highlighted the critical impact spinners like Yadav can have on a game. Ashwin emphasized that spinners’ lives can change within minutes, citing Kuldeep's ability to dismiss strong batsmen like Salman Ali Agha and Shaheen Shah Afridi in quick succession."
" What challenges did Kuldeep Yadav face while bowling on the Dubai wicket, and how did these affect his performance?","2: Kuldeep Yadav faced challenges on the Dubai wicket, which was described as ""dead"" by Ravichandran Ashwin. Despite the wicket’s lack of assistance for spinners, Kuldeep effectively utilized the conditions to his advantage. Ashwin explained that the rotations and hip drive are crucial for a spinner, especially after Yadav's sports hernia injury. Kuldeep managed to generate enough spin and pace to successfully dismiss key Pakistani batsmen on such a tough wicket."
 How did Axar Patel contribute to ensuring Virat Kohli could reach his century against Pakistan in the Champions Trophy 2025 match?,"1: Axar Patel contributed by mentally calculating the runs needed for Virat Kohli to reach his century, hoping to avoid hitting boundaries or getting out. Despite taking a single at one point, which led to some fans booing as they wanted Kohli to have maximum strike, Axar was keenly aware of the situation and Kohli's milestone."
" What did Rohit Sharma do when Virat Kohli was on 96 runs, and how did Kohli eventually reach his century?","2: When Virat Kohli was on 96 runs, skipper Rohit Sharma humorously gestured for Kohli to finish the game with a six. However, Kohli chose to seal the match and bring up his century with an elegant drive through the covers, finishing the game stylishly and scoring his 51st hundred."
" Why does Mohammad Hafeez believe it's time for Pakistan to look beyond their current pace attack of Shaheen Afridi, Naseem Shah, and Haris Rauf?","1: Mohammad Hafeez believes it's time for Pakistan to move on from their current pace attack because this trio has consistently failed to deliver significant victories in major tournaments, such as the 2023 World Cup, the 2022 T20 tournament in Melbourne, and the current Champions Trophy. Hafeez suggests giving opportunities to other bowlers like Mohammad Ali, Khurram Shahzad, Mohammad Wasim Jr, Akif Javed, and Mir Hamza to strengthen the team."
" What are Pakistan's chances of staying in the Champions Trophy, according to the article?","2: Pakistan's chances of staying in the Champions Trophy hinge on a series of specific outcomes: they need Bangladesh to upset New Zealand on Thursday, defeat Bangladesh in their last group game, and hope that India beats New Zealand in another group game. This combination of results would allow net run rate to come into play, potentially keeping Pakistan in the tournament."
 What are the key attributes of Shubman Gill's batting that have impressed Sanjay Bangar?,"1: Sanjay Bangar praised Shubman Gill's strong foundations in batting and his ability to perform consistently in one-day cricket over nearly two-and-a-half years. Bangar highlighted Gill's phenomenal timing, particularly noting his powerful straight drive and on-drive, which allow him to hit the ball hard enough to clear fielders in the 30-yard circle."
 How has Shubman Gill's recent performance affected his ICC ODI rankings?,"2: Shubman Gill dethroned Pakistan's Babar Azam from the top spot in the ICC ODI rankings. In the latest ICC rankings list, Gill is ranked first with 796 rating points, while Babar Azam has 773 points. India skipper Rohit Sharma holds the third position with 761 points."
