query,contexts
 What was Varun Chakravarthy's strategy on a pitch that was not offering much turn in the Champions Trophy final against New Zealand?,"1: Varun Chakravarthy's strategy on the pitch that was not offering much turn was to bowl straight and stick to the stump line, hoping that the batsman would make a mistake. Despite the lack of assistance from the pitch, he managed to dismiss Will Young and Glenn Phillips, taking 2 wickets for 45 runs in his 10 overs."
" How did Varun Chakravarthy feel about the target set by New Zealand in the Champions Trophy final, and what did he say about his relationship with his teammates?","2: Varun Chakravarthy felt that the target of 252 set by New Zealand was gettable if India batted well in the initial phase. He also expressed his desire to build bonds with his teammates, mentioning that he enjoys talking to Kuldeep Yadav, Ravindra Jadeja, and Axar Patel. Chakravarthy acknowledged that he was relatively new to the team setup and was looking forward to forming strong relationships with his fellow players."
" What were Mohammed Shami's bowling figures in the Champions Trophy final against New Zealand, and how did they rank among Indian bowlers in the tournament's history?","1: Mohammed Shami recorded bowling figures of 1/74 in nine overs with an economy of 8.22 runs per over in the Champions Trophy final against New Zealand. These figures were the second-most expensive by an Indian in the history of the Champions Trophy, following Umesh Yadav's analysis of 1/75 in 10 overs against South Africa in 2013."
 How did Shami's performance in the Champions Trophy compare with his previous performances in international tournaments?,"2: Despite a rough outing in this particular Champions Trophy match, Shami had an impressive tournament overall. Before the final, he opened the tournament with a five-wicket haul against Bangladesh and led the bowling charts with three wickets in the semi-final against Australia. He finished the tournament as India’s joint-highest wicket-taker with nine wickets in five outings. This was Shami's first appearance in a Champions Trophy, coming after his notable performances in the 2023 ODI World Cup, including a remarkable seven-wicket haul against New Zealand in the semi-final."
" Why is Kuldeep Yadav often a target of frustration for his teammates, particularly captain Rohit Sharma and senior player Virat Kohli?","1: Kuldeep Yadav becomes a target of frustration for his teammates due to his occasional lapses into a state of laxity, such as failing to collect a throw or bowling flatter and not seeking wickets. His teammates, particularly captain Rohit Sharma and senior player Virat Kohli, express their ire because they recognize the value of Kuldeep as a strike-bowler and want to ensure he stays focused and effective on the field."
 How did Kuldeep Yadav's knee injury and subsequent recovery process lead to improvements in his bowling performance?,"2: Kuldeep Yadav's knee injury, which initially threatened his career, inadvertently led to improvements in his bowling. During his rehabilitation, he was advised by the NCA physical trainer Ashish Kaushik to make adjustments to his action to protect his knee. Kuldeep's childhood coach, Kapil Pandey, worked with him to modify his run-up, increasing his aggression and pace while also requiring him to bowl long hours in practice. This helped him regain his rhythm and confidence, ultimately allowing him to become more effective on the field with quicker deliveries and better gameplay."
" Who was the leading run-scorer in the ICC Champions Trophy 2025, and how many runs did they score?","1: The leading run-scorer in the ICC Champions Trophy 2025 was New Zealand's Rachin Ravindra, who scored 263 runs."
 What were Shreyas Iyer's notable performances in the ICC Champions Trophy 2025 that helped him surpass Virat Kohli in the tournament's run-scoring charts?,"2: Shreyas Iyer had a notable performance with a century against Pakistan and a match-winning fifty in the semi-final against Australia, which helped him surpass Virat Kohli to become India's highest run-scorer in the tournament."
 Who are the top wicket-takers in the ICC Champions Trophy 2025 and what notable performances did they have during the tournament?,"1: Varun Chakaravarthy of India and Mohammed Shami finished in the top three wicket-takers of the ICC Champions Trophy 2025, alongside New Zealand's Matt Henry who leads the chart despite being ruled out of the final. Chakaravarthy took nine wickets in just three appearances, including a 5/42 performance against New Zealand. Shami also took nine wickets in five matches, beginning with a five-wicket haul against Bangladesh and continuing with strong performances against New Zealand and Australia in the semi-final."
 How does the bowling performance of players in the ICC Champions Trophy 2025 compare to past tournaments?,"2: In the ICC Champions Trophy 2025, Varun Chakaravarthy and Mohammed Shami each took nine wickets, which places them among the top performers. However, their wicket tally still falls short of the record for most wickets in a Champions Trophy edition, which is held by Pakistan’s Hasan Ali and West Indies’ Jerome Taylor, both of whom took 13 wickets in the 2017 and 2006 tournaments, respectively."
 What record did Rohit Sharma equal during the Champions Trophy Final against New Zealand?,1: Rohit Sharma equalled former West Indies captain Brian Lara's all-time record of losing 12 consecutive tosses in men's One Day Internationals during the Champions Trophy Final against New Zealand.
" What was Rohit Sharma's reaction to losing the toss in the final, and how does he view the importance of the toss in the game?","2: Rohit Sharma had a wry smile on his face after losing the toss to Mitchell Santner. He stated that India has experienced both batting first and chasing successfully, emphasizing that what matters most is how well the team plays, rather than the outcome of the toss. This approach helps take the pressure off the toss as a factor in the game's outcome."
 How did Ravi Shastri compare Virat Kohli's energy on the field to other top sportspeople?,"1: Ravi Shastri compared Virat Kohli's energy on the field to that of renowned sports figures like Cristiano Ronaldo, Lionel Messi, Novak Djokovic, and Rafael Nadal. He emphasized that Kohli's energy and charisma while playing are similar to these top athletes, which not only draws people to watch him play but also rubs off on others."
 What did Ravi Shastri say about Virat Kohli's approach in ODIs that sets him apart?,"2: Ravi Shastri stated that Virat Kohli sets himself apart in ODIs by returning to his successful strategy of taking singles, hitting the ball along the ground, and going for big shots when necessary. Shastri noted that Kohli's ability to pick up singles with ease takes the pressure off, especially when paired with aggressive players like Shreyas Iyer, making it easier for him during the chase."
" How effective has Kane Williamson been in One Day Internationals (ODIs) against India, and how has he performed in different conditions?","1: Kane Williamson has been remarkably consistent in ODIs against India, scoring 1,228 runs in 30 matches with an average of 45.48. He holds the record for the most fifty-plus scores by a New Zealand batter against India, totaling 11 fifties and a century. Despite his lower average of 34.80 in Asia compared to 58.09 at home, Williamson has been a key contributor, especially in high-profile games. For instance, during the 2019 World Cup semi-final, he scored a match-winning 67. Overall, he has been a potent force with a slightly lower average of 33.86 in losing causes compared to 59.54 in victories over India."
 Which Indian bowlers are anticipated to pose a challenge to Kane Williamson in the Champions Trophy final?,"2: In the upcoming Champions Trophy final, Indian spinners such as Varun Chakaravarthy, Ravindra Jadeja, Kuldeep Yadav, and Axar Patel are expected to pose a significant challenge to Kane Williamson. Additionally, there is the possibility of seam bowler Mohammad Shami impacting early on. The varied bowling options indicate India's strategic depth in tackling Williamson, who has been consistently formidable in ICC ODI outings against India."
 How has India's performance in ICC tournaments changed in recent years according to the Champions Trophy Final 2025 analysis?,"1: India's performance in ICC tournaments has significantly improved in recent years, as they have become a big-game outfit after a decade without a major ICC trophy. They have gone through three tournaments losing just one game. Despite challenges, such as losing all five tosses in the tournament, India has demonstrated total dominance on the field. The painful defeat in the 2023 50-over World Cup appears to have motivated the team, as they have not lost an ICC event match since then."
 Describe the impact of Kuldeep Yadav's bowling in the final match against New Zealand.,"2: Kuldeep Yadav had a significant impact on the final match against New Zealand. Despite having a tough tournament performance-wise, Yadav played a crucial role by taking the big wickets of Rachin Ravindra and Kane Williamson in his first two overs. This moved the game in India's favor and showed the value of bringing him into the attack earlier than usual. His performance was celebrated by his teammates, marking a turnaround from previous criticism during the tournament."
 Who has Nasser Hussain identified as a challenge for New Zealand in the Champions Trophy final against India?,1: Nasser Hussain has identified India's mystery spinner Varun Chakaravarthy as a challenge for New Zealand in the Champions Trophy final.
 What are the strengths of India's spin-bowling set-up according to Nasser Hussain?,"2: According to Nasser Hussain, the strengths of India's spin-bowling set-up include the variety offered by the four spinners, who are all different and two of whom are genuine all-rounders. Additionally, the quicker spin of Varun Chakaravarthy and Ravindra Jadeja is considered vital on the slower, lower, and turning pitches like those in Dubai."
 How did India perform in the Champions Trophy 2025 final against New Zealand?,"1: India won the Champions Trophy 2025 final against New Zealand by four wickets. Rohit Sharma was the top scorer for India with 76 runs. Earlier, Daryl Mitchell had been the top scorer for New Zealand with 63 runs, while Michael Bracewell contributed an unbeaten half-century."
 Where and how can fans watch the India vs New Zealand Champions Trophy 2025 final live in India?,"2: Fans in India can watch the Champions Trophy 2025 final between India and New Zealand live on the Star Sports and Sports18 TV channels. The match will also be streamed live on the JioHotstar app and website. The match begins at 2:30 PM IST, with the toss scheduled for 2 PM IST."
 Why does Michael Atherton consider India as the favorites to win the Champions Trophy 2025 final?,"1: Michael Atherton considers India the favorites to win the Champions Trophy 2025 final because they are unbeaten in the tournament, have had extensive exposure to playing at the Dubai International Cricket Stadium, and possess a well-rounded team. He highlights their aggressive opening partnership, the presence of the best ODI player in history at number three, an in-form Shreyas Iyer, a variety of all-rounders, and the impactful return of Mohamed Shami, making it hard to identify any weaknesses in the team."
 What factors could influence the outcome of the Champions Trophy 2025 final between India and New Zealand at Dubai International Cricket Stadium?,"2: The outcome of the Champions Trophy 2025 final at the Dubai International Cricket Stadium could be influenced by the condition of the pitch, which has progressively slowed down. Spin is expected to play a significant role as the ball did not bounce more than knee height in the second innings during India's group game against New Zealand. Additionally, India's familiarity with the ground and the absence of matches in Pakistan due to security concerns also contribute to the favorable conditions for India."
 What criticism did Rashid Latif have for former England cricketers regarding the ICC Champions Trophy schedule?,"1: Rashid Latif criticized former England cricketers, namely Nasser Hussain, Michael Atherton, and David Lloyd, for complaining about the ICC Champions Trophy schedule, which they claimed favored India. Latif questioned why they were overly concerned with this issue, using the phrase ""Begaani shaadi mein abdullah deewana"" to imply that they were unnecessarily getting involved in matters that did not directly affect them."
" According to Rashid Latif, who is to blame for the scheduling issues in the ICC Champions Trophy, and what should cricket board representatives focus on?","2: Rashid Latif blamed both the ICC and all cricket board representatives for the scheduling issues in the ICC Champions Trophy. He argued that they should not attend ICC meetings simply for leisure purposes but rather to fulfill their responsibilities by ensuring proper scheduling. He emphasized that once the schedule was agreed upon and made a mistake, it's unproductive to complain after the fact, especially by those who were involved in the initial consent."
 How is the pitch at the Dubai International Stadium expected to behave during the ICC Champions Trophy 2025 final between India and New Zealand?,"1: The pitch at the Dubai International Stadium is expected to be a low-scoring surface that favors spinners. Batting becomes more challenging as the ball gets older and softer in the latter overs, so teams will likely aim to capitalize during the first 10 overs when the ball is new and hard."
" What weather conditions are anticipated for the India vs New Zealand final in the Champions Trophy 2025, and how might they influence team strategy?","2: The temperature in Dubai is expected to be around 32 degrees centigrade during the final. There has not been much dew in the second innings at this venue, making conditions dry. With these temperature conditions and the pressure of a final, teams winning the toss might prefer to bat first to put runs on the board and avoid batting under potentially more challenging conditions later in the match."
"** What are some of the challenges Rohit Sharma faces from the New Zealand bowlers in the Champions Trophy, and how have they affected his performance?

**","1:** Rohit Sharma faces significant challenges from New Zealand bowlers, primarily due to their height and bowling style. Bowlers like Kyle Jamieson and Will O’Rourke, with their exceptional height, release the ball from roughly 2.5 meters, creating extra bounce which Rohit finds difficult to handle. This extra bounce complicates his ability to drive on the rise and hampers his pull shots, as mistiming or failing to adjust his balance leads to his dismissal. Additionally, Jacob Duffy's precision and capability to bowl a fiery out-swinger present further challenges, compelling Rohit to adopt a more cautious approach. These challenges have impeded his ability to build substantial innings, evident from his relatively low scores and premature dismissals in the tournament.

**"
"** How have the conditions and game plans from opposing teams affected Rohit Sharma's batting strategy in the Champions Trophy?

**","2:** The sluggish surfaces and tailored game plans from opposing teams have significantly impacted Rohit Sharma's batting strategy. The slower nature of the pitches curtails his aggressive style, as the ball's sluggishness makes it risky to engage in his usual attacking shots. Opponents have adapted from strategies seen in the ODI World Cup, focusing on back-of-length deliveries targeting the stumps rather than full and wide deliveries that might prompt a drive. This adjustment has forced Rohit to restrain his natural game and re-evaluate his shot selection, impacting his ability to set a dominating tone at the beginning of innings and contributing to a decrease in his scoring rate and overall effectiveness."
 Why is India likely to field an unchanged XI for the Champions Trophy 2025 final against New Zealand?,"1: India is likely to field an unchanged XI for the Champions Trophy 2025 final against New Zealand due to their consistent performance and familiarity with the conditions. Despite Kuldeep Yadav's recent lack of form, he remains a proven match-winner, and the team prefers not to tamper with their winning combination, especially after their success in defeating Australia in the semifinal."
" What is the status of New Zealand pacer Matt Henry for the final match against India, and who could replace him if he is unavailable?","2: Matt Henry is currently nursing a shoulder niggle but has not been completely ruled out for the final match against India. He is reportedly recovering well, and New Zealand is hopeful of including him in the playing XI. If Henry cannot play, New Zealand has Nathan Smith or Jacob Duffy as potential replacements in their squad."
" What key performances highlighted the match between UP Warriorz and RCB in the Women’s Premier League 2025, and how did they impact RCB's playoff hopes?","1: Richa Ghosh and Sneh Rana delivered notable performances for RCB in their crucial match against UP Warriorz, with Ghosh scoring 61 off 29 balls. Despite her efforts, after being dismissed by a catch from Chinelle Henry, RCB's chances dwindled. Sneh Rana contributed with a quick cameo, hitting two fours and three sixes, but it wasn't enough as RCB fell short by 12 runs. Consequently, RCB's hopes of making it to the playoffs were dashed as UP Warriorz set the highest Women’s Premier League total, ending the match with 225/5."
" What challenges did RCB face throughout the Women's Premier League 2025 season, and how did these affect their overall performance?","2: RCB faced significant challenges throughout the Women’s Premier League 2025 season, including the loss of their top three wicket-takers from the previous season, Shreyanka Patil, Asha Sobhana, and Sophie Molineux, due to injuries before the tournament began. Despite initial successes, their form faltered during home games. Smriti Mandhana, the team captain, also struggled with her batting form, which contributed to the inconsistent team performance. These factors caused RCB to lose key matches and impacted their chances of advancing to the playoffs, ultimately resulting in a disappointing season for the defending champions."
" Why did Gautam Gambhir, Rohit Sharma, and Virat Kohli have an intense meeting on the field before the Champions Trophy final against New Zealand?","1: Gautam Gambhir, Rohit Sharma, and Virat Kohli had an intense meeting on the field to discuss the pitch for the final match and consider whether India needed to make any changes to their strategy. The challenge was to decide whether to bat first or second under the changing conditions in Dubai, especially considering the possibility of dew that could benefit the team batting second. They also had to rethink their four-spinner strategy that had been successful in previous matches."
 How has India's preparation and performance been in the lead-up to the final match against New Zealand?,"2: India has played near flawless cricket during the campaign, overcoming various challenges with a strong squad that has consistently outperformed opponents. They have had a successful run, similar to their performance in the 2023 World Cup, and are fully prepared for the final against New Zealand. Despite past pressure, the victory in the T20 World Cup last year has reduced some pressure, and the team feels more balanced. They aim to maintain their momentum and capitalize on their strengths, while acknowledging New Zealand as a formidable opponent."
 What record did UP Warriorz achieve in their match against Royal Challengers Bengaluru in the Women’s Premier League?,"1: UP Warriorz set the record for the highest team total in Women's Premier League history by scoring 225/5 in their match against Royal Challengers Bengaluru, surpassing the previous highest score of 223/2 set by Delhi Capitals against RCB in 2023."
" How did Georgia Voll perform in the match, and what milestone did she almost achieve?","2: Georgia Voll had a superb performance by scoring an unbeaten 99 runs in 56 balls, including 17 fours and one six. She equaled the highest individual score in the WPL but fell just short of becoming the first player to score a century in the tournament's history."
 Why is the Champions Trophy final important for Virat Kohli?,"1: The Champions Trophy final is crucial for Virat Kohli because, despite being one of the greatest ODI batsmen, he has had a skewed relationship with title clashes in ICC tournaments, averaging just 35 in four innings. This tournament offers him a chance to deliver a substantial knock in his favorite format, especially after a tough period of criticism and challenges on previous tours. The final allows him to solidify his legacy and possibly lead India to another memorable tournament victory."
 How has Virat Kohli distinguished himself in the Champions Trophy leading up to the final?,"2: In the Champions Trophy leading up to the final, Virat Kohli has distinguished himself through several exceptional performances on sluggish pitches. Notably, he scored an unbeaten 100 against Pakistan and a vital 84 in the semifinal against Australia. Although not in the top three run-scorers, with 217 runs, Kohli has consistently been India's go-to batsman, impressively managing to get the job done with singles and twos, reflecting his control and game plan, as highlighted by former India coach Ravi Shastri."
 What qualities does Suryakumar Yadav attribute to Rohit Sharma in his leadership style?,"1: Suryakumar Yadav describes Rohit Sharma as the most ""honest and clean-hearted man,"" who is natural and instinctive in his leadership. Rohit is known for putting others in front, enabling them to grow, and is easily approachable. He raises his hand to take on responsibilities for others, maintaining a clean-hearted and honest demeanor both on and off the field."
 What is Suryakumar Yadav's outlook on India's performance in the upcoming ICC Champions Trophy final against New Zealand?,"2: Suryakumar Yadav is confident that India will win the ICC Champions Trophy final against New Zealand. He believes that India has been playing an exceptional brand of cricket over the past two years and advises his teammates to play ""fearless"" and aggressive cricket. He emphasizes the importance of being themselves to achieve victory."
 What is Shubman Gill's perspective on winning trophies and how does he believe it impacts a team's performance in big matches?,"1: Shubman Gill believes that once a team wins their first trophy after a long period, it helps them in big occasions by reducing desperation, which he views as detrimental. Gill states that winning a trophy gives momentum and helps players avoid being desperate for titles. This lack of desperation allows teams to handle pressure better and focus on the game, ultimately improving their chances of winning."
" According to the article, who does former India coach Ravi Shastri consider being the favourites in the 2025 Champions Trophy final, and what factors could influence the outcome?","2: Ravi Shastri considers India to be the firm favourites to win the 2025 Champions Trophy final against New Zealand. However, he acknowledges that New Zealand can potentially defeat India, making India favourites ""but only just."" Shastri highlights Virat Kohli's current form as a potential game-changer while also acknowledging the threat posed by Kane Williamson's ability to seize crucial moments."
 What are the conditions for Royal Challengers Bengaluru (RCB) to qualify for the playoffs in the Women’s Premier League?,"1: Royal Challengers Bengaluru's (RCB) chances to qualify for the playoffs are slim, but possible. They must win their last two matches against UPW and MI to stay in contention. Additionally, they require Mumbai Indians and Gujarat Giants to play each other before RCB's final match, ensuring they know the necessary margin to achieve a better Net Run Rate (NRR) than the loser of that match-up. A defeat against UPW on Saturday would eliminate them from the tournament."
 How can Mumbai Indians (MI) secure a spot in the playoffs and potentially claim the top position in the league stage?,"2: Mumbai Indians (MI) can secure a playoff spot with just one win out of their last two matches against Gujarat Giants and RCB. If they win both matches, they have the potential to claim the top position in the league stage from Delhi Capitals, provided they maintain a better run rate. If MI loses both matches, they will need to ensure the losses are by narrow margins so they have a chance to outdo RCB's NRR and stay in the third position."
 What was Shubman Gill's response to the retirement speculations surrounding Virat Kohli and Rohit Sharma in the Indian dressing room?,"1: Shubman Gill downplayed the speculations about Virat Kohli and Rohit Sharma's retirement, stating that there is no talk about retirement in the Indian dressing room as of now."
" How has the Indian team performed leading up to the Champions Trophy final against New Zealand, and what does Shubman Gill say about the team's batting lineup?","2: India has had an unbeaten run to the final, with Virat Kohli scoring one century and Rohit Sharma providing strong starts with aggressive batting. Shubman Gill describes the batting lineup as the best he has been part of, highlighting the depth in batting that allows the top order to bat with more freedom."
