query,contexts
 What is the schedule and location for the NZ vs PAK T20I series and the subsequent ODI series?,"1: The NZ vs PAK T20I series consists of five matches starting on March 16, with the first match at Hagley Oval, Christchurch. The subsequent T20Is will be played at University Oval, Dunedin on March 18; Eden Park, Auckland on March 21; Bay Oval, Mount Maunganui on March 23; and Sky Stadium, Wellington on March 26. Following the T20I series, there will be a three-match ODI series starting on March 29 at McLean Park, Napier, followed by matches on April 2 at Seddon Park, Hamilton, and April 5 at Bay Oval, Mount Maunganui."
" Which players are unavailable from New Zealand's regular T20 squad due to IPL commitments, and who are some new or returning players in the squad?","2: New Zealand T20 regulars Dev Conway, Lockie Ferguson, Glenn Phillips, Rachin Ravindra, and white-ball captain Mitchell Santner are unavailable for the series against Pakistan due to IPL commitments. The T20 squad features a mix of established and returning players, including Michael Bracewell (captain), Finn Allen, Daryl Mitchell, and Jimmy Neesham among others."
 When and where is the New Zealand vs Pakistan 1st T20I match scheduled to take place?,"1: The New Zealand vs Pakistan 1st T20I match is scheduled to take place on Sunday, March 16, at the Hagley Oval in Christchurch."
 How can viewers in India watch the live streaming of the New Zealand vs Pakistan 1st T20I match?,2: Viewers in India can watch the live streaming of the New Zealand vs Pakistan 1st T20I match on the Sony LIV and Fancode apps and websites. The match will also be televised live on the Sony Sports Network.
 What are KS Bharat's key achievements and recent performances in cricket?,"1: KS Bharat has played 7 Tests for India, and he caught attention in 2015 by becoming the first wicketkeeper-batsman to score a triple-century in the Ranji Trophy. He has played 105 first-class matches, scoring 5686 runs, including 10 centuries and 32 fifties. Despite his struggle against Australia in the World Test Championship final, Bharat improved his batting skills, scoring 64, 15, and 116 not out for India 'A' against England Lions in Ahmedabad in 2024."
 Why is KS Bharat's opportunity with the Dulwich Cricket Club significant for his cricket career?,"2: KS Bharat's stint with the Dulwich Cricket Club is significant because it provides him a platform to prove his skills following his absence in the Indian national team. Coming off a period where his inclusion in Tests is unlikely, a successful outing with Dulwich and a strong Ranji Trophy performance could help reinvigorate his chances for a comeback. Additionally, his experience and expertise will be invaluable to Dulwich as they aim to make an impact in the Premier Division."
 Why was Rohit Sharma assured of his continuation as India’s Test captain for the England tour?,"1: Rohit Sharma was assured of his continuation as India's Test captain for the England tour because the key decision-makers valued his tactical acumen and leadership qualities, which were deemed essential for success in England's challenging cricketing conditions. India required a captain who could demonstrate patience and tenacity, especially when faced with difficult scenarios during Test matches. Sharma's proven ability to strategize and manage pressure effectively, as seen in his handling of spinners and field placements, convinced the decision-makers to give him an extension as captain."
" How is Rohit Sharma’s leadership style perceived in comparison to former Indian captains, especially considering the England conditions?","2: Rohit Sharma’s leadership style is perceived as a blend of strategic patience and effective man-management, which is essential for succeeding in England's cricketing conditions. Unlike MS Dhoni's sometimes passive approach or Virat Kohli's aggressive style, Sharma embodies a middle path that prioritizes strategic thinking and persistent pressure without allowing the game to drift. His leadership is compared favorably to Rahul Dravid's approach in England, as both are seen as having the tenacity and composure needed to succeed in challenging overseas conditions."
 What recent successes has Sam Billings achieved as a captain in white-ball cricket?,1: Sam Billings has led the Oval Invincibles to victory in The Hundred for the past two seasons and won the ILT20 in the UAE with Dubai Capitals in February.
 Who are currently considered as potential candidates for England's next white-ball captains in ODIs and T20Is?,"2: Ben Stokes is tipped as England's next captain in the ODIs, while Harry Brook is considered for the T20Is."
" Why is Rohit Sharma likely to remain captain for the Test series in England, even after his recent struggles?","1: Rohit Sharma is likely to remain captain for the Test series in England due to India's overwhelming Champions Trophy triumph, which has led to the Board of Control for Cricket in India (BCCI) and its selection panel backing him to lead the team. Despite his recent struggles, the victory has increased confidence in his ability to lead, and he has expressed eagerness to continue playing red-ball cricket."
" What reasons did Rohit Sharma give for not specifying his long-term plans, especially concerning the 2027 World Cup?","2: Rohit Sharma did not specify his long-term plans for the 2027 World Cup because he considers it too far to make any commitments. However, he mentioned that he is currently enjoying his cricket and the team's dynamics. He also expressed joy in playing with the current team and the pride involved, suggesting that he is keeping his options open while he continues to enjoy his role and form."
" What are the contrasting conditions for Delhi Capitals and Mumbai Indians leading up to the WPL 2025 final, and how have the captains viewed these conditions?","1: The Delhi Capitals have had a relatively relaxed schedule leading up to the WPL 2025 final, having played only two matches in 14 days, which is uncommon in the fast-paced world of franchise cricket. Meanwhile, the Mumbai Indians have had a hectic week, playing matches on Monday, Tuesday, Thursday, and again in the final on Saturday, which might lead to exhaustion. Captains from both sides have spun these scenarios positively. Harmanpreet Kaur of Mumbai Indians highlighted the team's familiarity with the conditions as advantageous, while Meg Lanning of Delhi Capitals emphasized the opportunity for her team to refresh and train well despite their less busy schedule."
 How could the batting performances of Lanning and Shafali Verma impact the outcome of the WPL 2025 final for Delhi Capitals?,"2: Lanning and Shafali Verma form the most prolific batting pair in WPL history and their performance will be crucial for Delhi Capitals in the final. If they can provide a strong start, DC’s chances of winning significantly increase. In past WPL finals, Delhi Capitals’ batting failures have been a primary issue leading to their defeat. Therefore, a robust showing from the opening pair is considered vital to overcoming past shortcomings and clinching the title."
 How did Sachin Tendulkar and his teammates celebrate Holi with Yuvraj Singh during the International Masters League?,"1: Sachin Tendulkar, along with his International Masters League teammates like Yusuf Pathan and Rahul Sharma, celebrated Holi by ambushing Yuvraj Singh in his hotel room in Raipur. Tendulkar led a prank where they used a water gun and pretended to be from housekeeping to get Yuvraj to open the door. Once inside, they drenched Yuvraj with colors and water, capturing the festive spirit of Holi."
" What was Rahul Dravid's involvement in the Holi celebrations, despite his injury?","2: Despite nursing a serious injury on his left foot and wearing a cast, Rahul Dravid participated in the Holi celebrations with the Rajasthan Royals, his Indian Premier League team. A video showed players, led by Yashasvi Jaiswal, respectfully applying pink gulal on Dravid's face, allowing him to be part of the festivities while taking care of his injury."
 How has the IPL contributed to the improvement of Indian cricket according to Dinesh Karthik?,"1: According to Dinesh Karthik, the IPL has contributed to the improvement of Indian cricket by instilling a winning mentality in players. The financial gains from the league have been reinvested in infrastructure, enhancing the quality of sport. The IPL's influence has enabled India to field multiple competitive teams in international cricket simultaneously, showcasing a privileged assortment of skilled cricketers."
 How did Dinesh Karthik's experience with Glenn McGrath at Delhi Capitals influence his mindset?,"2: Dinesh Karthik's experience with Glenn McGrath at Delhi Capitals positively influenced his mindset by allowing him to observe and practice closely with one of the best, thereby becoming more comfortable and gaining confidence. This exposure to McGrath's winning mentality and the competitive approach of Australian cricket at the time was crucial in developing his own approach to the game."
" What challenges did Varun Chakarvarthy face after the 2021 T20 World Cup, and how did he view them in hindsight?","1: After the 2021 T20 World Cup, Varun Chakarvarthy faced significant challenges, including receiving threat calls and being followed by people after India's unsuccessful campaign. He mentioned that people even came up to his house, forcing him to hide at times. Despite these experiences, Chakarvarthy expressed understanding of fan emotions and remarked that looking back, he is happy and grateful for his current success. He acknowledged the past setbacks and criticism but is now focused on advancing to the next level in his career."
" How did Varun Chakarvarthy perform in the Champions Trophy 2025, and what impact did it have on his cricket career?","2: Varun Chakarvarthy had an impressive performance in the Champions Trophy 2025, taking nine wickets, including a five-wicket haul against New Zealand during the group phase. This performance served as a huge confidence booster for him, helping him feel that he belonged at the international level. His success in the tournament exceeded his expectations and led to his inclusion in the one-day team, despite not being initially prepared for it, signaling a positive turn in his cricket career."
 Why was the Sheffield Shield final moved from Adelaide Oval to Karen Rolton Oval?,"1: The Sheffield Shield final was moved from Adelaide Oval to Karen Rolton Oval because of conflicts with AFL's schedule, which included matches at Adelaide Oval on March 22 and March 30. AFL's concerns about the condition of the field for their matches, including issues related to grass cutting and player safety, led to this decision. AFL also requested compensation for potential injuries if the venue change occurred, which added to the decision to move the cricket match."
 What were the South Australian government’s actions and stance regarding the conflict between AFL and Cricket Australia over the Sheffield Shield final venue?,"2: The South Australian government, led by Premier Peter Malinauskas, supported hosting the Sheffield Shield final at Adelaide Oval. Malinauskas advocated strongly for this plan and criticized AFL's compensation demands. He stated that his government would not simply hand over cash to resolve the clash and emphasized acting in the fans' interest by hosting the cricket event at the more prestigious venue. However, despite his efforts, the final was eventually moved to Karen Rolton Oval."
" What was Matthew Kuhnemann's reaction to the ICC's clearance of his bowling action, and how did he feel about the assessment process?","1: Matthew Kuhnemann expressed confidence in his bowling action and the assessment process conducted by the ICC. He stated that he was always sure of a positive outcome since he had played over 100 professional games without any prior questioning of his action. Kuhnemann described the assessment as straightforward, involving bowling 20-30 balls while being surrounded by cameras and sensors. He was pleased to complete the process swiftly and resume his cricket season."
 How did the period when his bowling action was under review affect Matthew Kuhnemann’s cricketing activities and future plans?,"2: During the review of his bowling action, Matthew Kuhnemann was unable to participate in international cricket but remained eligible for Australia's domestic competitions. He missed a Sheffield Shield match against South Australia but later played for Tasmania against Queensland after his action was cleared. Kuhnemann took the break as an opportunity to recover physically and prepare for the remainder of the season. Looking ahead, he expressed interest in potentially joining the Australian Test team for the tour to the West Indies, acknowledging the favorable conditions there for spin bowling."
 What is the main concern expressed by Inzamam-ul-Haq regarding Indian players' participation in international franchise leagues?,"1: Inzamam-ul-Haq expressed concern that, while players from around the world participate in the Indian Premier League (IPL), Indian players are not allowed to play in other franchise leagues globally. He suggested that if Indian players are not released to play in international leagues, then other cricket boards should consider not sending their players to the IPL."
" How has the political stance between India and Pakistan impacted cricket tournaments, according to the article?","2: According to the article, due to India's refusal to travel to Pakistan for the Champions Trophy 2025 because of political reasons, all matches involving India were held in Dubai. As a result, Pakistan, the official hosts of the tournament, had to travel to the UAE to play against India, and the final was also hosted in Dubai due to India's progression in the tournament. This showcases the impact of political relations on cricket scheduling and hosting."
 Why is David Warner appealing to English fans not to boo the London Spirit team in the Hundred tournament?,"1: David Warner is appealing to English fans not to boo the London Spirit team because he wants the fans to support the team. Although he acknowledges that English crowds might want to come at him personally, which he enjoys as it motivates him, he emphasizes that support for his team, London Spirit, should remain positive."
 What are David Warner's thoughts on England's 'Bazball' approach and its viability in Australia?,"2: David Warner is skeptical about the 'Bazball' approach working in Australia due to the conditions there, such as the bounce of the wickets. He finds it a high-risk strategy for the Australian environment and suggests that wearing the wickets out and getting into the later days of a test is a better approach. He mentions that if England were to continue with this high-tempo, high-energy approach, they might face challenges and could potentially lead to matches ending sooner than expected."
 What was Cooper Connolly’s experience facing Mohammed Shami in the Champion Trophy semi-final?,"1: Cooper Connolly described Mohammed Shami as a ""world class player"" and acknowledged the experience as an incredible learning opportunity. Connolly faced nine deliveries from Shami and edged behind for a nine-ball duck. Despite this, he emphasized gaining valuable insights from the game and praised Shami’s skill, calling him a world-class bowler."
 How did Cooper Connolly respond to his performance during the semi-final match against India?,"2: Cooper Connolly reflected on his performance by acknowledging that it is normal to miss opportunities in cricket, such as dropping a catch or getting out for a duck, and emphasized the importance of focusing on the present challenges. Despite his initial setbacks, such as dropping Rohit Sharma and failing to score, he remained composed and focused on competing to help his team, eventually managing to bowl and claim the wicket of Sharma during the match."
 How did Nathan McSweeney describe his experience facing Jasprit Bumrah in the Border Gavaskar Trophy?,"1: Nathan McSweeney described facing Jasprit Bumrah as ""chaos"" and admitted that it was a tougher challenge than he had anticipated. He mentioned that before facing Bumrah, he was naïve and thought it wouldn’t be a big deal, but soon realized Bumrah's skill and relentless ability to consistently pitch the ball in challenging areas for a batter."
" What was Jasprit Bumrah's impact in the Border Gavaskar Trophy series against Australia, and how did it affect Nathan McSweeney's performance?","2: Jasprit Bumrah had a significant impact in the Border Gavaskar Trophy, being named the Player of the Series with 32 wickets across five Tests. His performance put a lot of pressure on the Australian batting line-up, including Nathan McSweeney, who struggled against him. McSweeney scored only 72 runs in 3 matches and was dismissed by Bumrah 4 out of 5 times, leading to McSweeney being dropped from the Australian side for the last two Test matches."
 Why does Stuart Broad advise against appointing Ben Stokes as England's ODI captain?,"1: Stuart Broad advises against appointing Ben Stokes as England's ODI captain because he sees it as a move of desperation and is concerned about Stokes' workload and injury history. Broad mentions that Stokes has been managing knee injuries and questions the logic of adding the physically demanding 50-over format to Stokes' responsibilities, especially when he is prioritizing Test matches and not participating in the Indian Premier League to manage his physical condition."
 What is Rob Key's position on considering Ben Stokes for the ODI captaincy?,"2: Rob Key, the ECB managing director, considers Ben Stokes as a potential candidate for the ODI captaincy, despite the complexities associated with such a decision. He describes Stokes as one of the best captains he has ever seen and believes it would be unwise to ignore him as an option, although he acknowledges the need to carefully consider the implications on Stokes' workload and other commitments."
 What are the key performances for Mumbai Indians and Delhi Capitals in the WPL 2025 season leading up to the final?,"1: For Mumbai Indians, Nat Sciver-Brunt has been the standout performer, leading the most-run charts with 493 runs at an average of 70.43, while Hayley Matthews leads in wickets, holding the Purple Cap with 17 dismissals. For Delhi Capitals, Shafali Verma has been the leading run-scorer with 300 runs, followed by skipper Meg Lanning with 263 runs. Shikha Pandey and Jess Jonassen are the top wicket-takers for Delhi, each with 11 wickets."
" What time does the DC vs MI WPL 2025 Final start, and how can fans watch the live match?","2: The DC vs MI WPL 2025 Final starts at 7.30 PM IST, with the toss scheduled for 7 PM IST. Fans can watch the match live on the Star Sports Network or live-stream it on JioHotstar."
" How has the role of wicketkeepers in cricket evolved, according to Denesh Ramdin?","1: Denesh Ramdin mentioned that the role of wicketkeepers has evolved significantly since the emergence of players like Adam Gilchrist. Originally, wicketkeepers were primarily focused on their duties as keepers. However, with the evolution of cricket, the role has expanded to include significant contributions with the bat. Notable players who have shaped this modern role include Quinton de Kock, Brendon McCullum, and Mahendra Singh Dhoni."
" What makes Rishabh Pant a unique player, according to Denesh Ramdin, and what was notable about his recent IPL auction?","2: According to Denesh Ramdin, Rishabh Pant is unique because of his flamboyant batting style and the way he scores runs. At the recent IPL auction, Pant was notably signed by the Lucknow Super Giants for Rs 27 crores after a fierce bidding war, making him the most expensive player in auction history. His former team, Delhi Capitals, initially offered a Right To Match bid at Rs 20.75 crore, but the bidding escalated significantly, surpassing the previous high bid for Shreyas Iyer by the Punjab Kings."
 How has Rajasthan Royals' performance been in the last three IPL cycles under Sanju Samson's captaincy?,"1: Under Sanju Samson's captaincy, Rajasthan Royals have had a successful performance in the last three IPL cycles. They finished 3rd in the latest season, 5th in 2023, and were the runners-up in 2022. Sanju Samson highlighted that these seasons have been some of the best for the team, with a high winning percentage and an impressive roster of players."
 What approach has Sanju Samson taken towards team building and preparation in recent IPL seasons?,"2: Sanju Samson has focused on creating a balance of youth and experience within the Rajasthan Royals squad by bringing in new players ranging from a young 13-year-old to a seasoned 35-year-old. He emphasizes the importance of preparation, particularly during the 7-10 days leading up to the IPL season, where he engages in building relationships and understanding the personalities within the team. This has involved spending time outside his room, talking with players and coaches to build camaraderie, which he believes adds to the joy and effectiveness of his captaincy."
 What are the broadcasting details for watching the Sri Lanka Masters vs West Indies Masters International Masters League 2025 semi-final live on TV in India?,1: The International Masters League 2025 semi-final between Sri Lanka Masters and West Indies Masters will be aired live on the Colours Cineplex and Colours Cineplex Superhits channels in India.
 How many points did Sri Lanka Masters and West Indies Masters accumulate during the league stage of the International Masters League 2025?,"2: Sri Lanka Masters topped the points table with eight points, while West Indies Masters finished the league stage with six points in five games."
" How did Sanju Samson begin his association with Rajasthan Royals, and what role did Rahul Dravid play in it?","1: Sanju Samson began his association with Rajasthan Royals in 2013, when Rahul Dravid, who was the captain of the team at the time, spotted him during trials. Dravid invited Samson to play for the team after being impressed with his performance, marking the beginning of Samson's journey with the franchise."
" What is the significance of Rahul Dravid’s return to Rajasthan Royals for Sanju Samson, and how does it affect his leadership in the team?","2: Rahul Dravid’s return to Rajasthan Royals is significant for Sanju Samson as it brings a sense of continuity and mentorship. Dravid, who has previously been both captain and mentor for the Royals, now returns as the coach while Samson is the captain. Samson views this as a unique and special experience and looks forward to learning from Dravid, which he believes will enhance his leadership role within the team."
 Why will Mark Wood miss the entirety of England's Test series against India?,"1: Mark Wood will miss the entirety of England's Test series against India because he underwent surgery on his left knee due to ligament damage, which will rule him out of all cricket for four months."
" How long is Mark Wood expected to take for his recovery, and what are his plans for rehabilitation?",2: Mark Wood is expected to be fully fit by July 2025. He plans to work closely with the ECB medical team on his rehabilitation and recovery during this period.
 Who has been appointed as the captain of Delhi Capitals for the IPL 2025 season?,1: Axar Patel has been appointed as the captain of Delhi Capitals for the IPL 2025 season.
 What has been Axar Patel's performance with the Delhi Capitals since joining the franchise in 2019?,"2: Since joining Delhi Capitals in 2019, Axar Patel has played 82 matches, scored 967 runs, and picked up 62 wickets with an impressive economy of 7.09."
" What contribution did Ricky Ponting highlight from Ravindra Jadeja, Axar Patel, and Hardik Pandya in India's 2025 Champions Trophy victory?","1: Ricky Ponting highlighted the ""outstanding"" performance of India's all-rounders Ravindra Jadeja, Axar Patel, and Hardik Pandya throughout the 2025 Champions Trophy. He noted that these players provided India with incredible batting depth and a well-balanced team overall, which contributed to their success. Ponting also emphasized the crucial role played by Hardik Pandya with the new ball, helping to support India's spin attack during the middle overs."
" How did Axar Patel improve his batting, according to Ricky Ponting?","2: According to Ricky Ponting, Axar Patel improved his batting significantly by working on his hitting game, especially under the guidance of Ponting at Delhi Capitals. Patel enhanced his batting by realigning his front foot for better lofted shots, maintaining his hitting shape, and developing scoring areas square of the wicket. This improvement allowed him to play crucial cameos in the Champions Trophy, supporting the team's lower-order batsmen."
