query,contexts
 Why is Ravi Shastri advocating for the use of four spinners in India's semi-final match against Australia in the Champions Trophy in Dubai?,"1: Ravi Shastri supports the use of four spinners because he believes the pitch in Dubai is showing signs of wear, being a ""little tired,"" which should favor spin bowlers. He suggests that if India bats first and sets a target of over 240-250, it would be competitive enough due to the conditions that will benefit their spin attack."
" What are the differing opinions about India's decision to field multiple spinners, according to the article?","2: Former Indian coach Ravi Shastri and former Indian selector Kris Srikkanth favor the use of four spinners, with Shastri highlighting the pitch conditions and Srikkanth emphasizing the confusion it might cause in the Australian camp. However, former Indian spinner Ravichandran Ashwin criticized the decision to take five spinners to Dubai, suggesting it's excessive and that they might have taken one or two too many spinners."
 Why did Rohit Sharma dismiss the notion that India has an added advantage of playing all Champions Trophy matches in Dubai?,"1: Rohit Sharma dismissed the notion of India having an added advantage of playing in Dubai by highlighting that the pitches there have presented different challenges for his team as well. He pointed out that Dubai is not their home ground and the conditions have been new and variable for them, with different pitches behaving differently in each match."
 How did the conditions in the match against New Zealand differ from other matches according to Rohit Sharma?,"2: Rohit Sharma mentioned that during the match against New Zealand, the team noticed the ball swinging, which was not observed in their first two games. Additionally, there was a slight difference in the behavior of spin on the pitch. This variability in conditions across matches further supports his argument that India does not have a specific advantage in Dubai."
 How does India skipper Rohit Sharma plan to approach the semifinal match against Australia in the Champions Trophy?,"1: Rohit Sharma plans to approach the semifinal match against Australia in the same way India approached the last three matches in the Champions Trophy. He emphasized that they should focus on their own game by following the strategies and plans they have been using, irrespective of the pressure of playing against a strong team like Australia. He highlighted the importance of understanding the opposition's style of play while staying committed to their own strategies."
 What are Rohit Sharma's views on the absence of big Australian players in the tournament and its potential impact?,"2: Rohit Sharma doesn't believe that the absence of some big Australian players, such as Pat Cummins, Josh Hazlewood, Mitchell Starc, Mitchell Marsh, and Marcus Stoinis, will significantly affect Australia's performance. He points out that Australia has been a great team over the years and expects them to put up a strong fight. Sharma stresses that the Indian team should concentrate on their tasks and execute them well to achieve the desired results, regardless of the opposition's changes."
 What are the current standings and recent performances of UP Warriorz and Gujarat Giants in the WPL 2025?,"1: UP Warriorz and Gujarat Giants are currently tied with Royal Challengers Bengaluru at 4 points each in the WPL 2025 table; however, UP is in the 3rd spot, RCB is in 4th, and GG is at the bottom. In their recent performances, Gujarat Giants secured a significant win over Bengaluru in their last match, while UP Warriorz suffered a defeat against Mumbai Indians."
 Who are some of the key players to watch from UP Warriorz and Gujarat Giants in their upcoming WPL 2025 match?,"2: From UP Warriorz, Sophie Ecclestone is a player to watch as she is in good form, while the top order has struggled. For Gujarat Giants, skipper Ashleigh Gardner stands out as the only bright spot in an otherwise struggling batting lineup that includes players like Dayalan Hemalatha and Harleen Deol, who have been out of form."
 What notable achievements did Ajinkya Rahane accomplish in the domestic season leading up to his appointment as KKR captain for IPL 2025?,"1: Ajinkya Rahane had a prolific domestic season with Mumbai, leading them to the Irani Cup and Syed Mushtaq Ali Trophy titles. In the SMAT T20s, he topped the batting charts with 469 runs in eight innings, averaging 58.62 with a strike rate of 164.56 and scoring five half-centuries."
" How did Venkatesh Iyer rejoin KKR for the IPL 2025 season, and what was his significance in the player auction?","2: Venkatesh Iyer was initially released to the player pool ahead of the IPL 2025 Mega Auction but was reacquired by KKR with a bid of Rs 23.75 crore, making him the third-most expensive Indian player in the league. His leadership qualities and previous franchise experience with KKR contributed to his significance."
 What is the weather forecast for the India vs Australia Champions Trophy 2025 semi-final match in Dubai?,"1: The weather forecast for the India vs Australia Champions Trophy 2025 semi-final in Dubai predicts a bright and sunny day, with temperatures likely to hover in the 20s, providing ideal playing conditions for both teams."
 How has India performed in the group stage of the Champions Trophy 2025 leading up to the semi-final against Australia?,"2: India won all three of their group games in the Champions Trophy 2025. In their last Group A fixture, they defeated New Zealand by 44 runs, securing their place in the semi-final against Australia."
 Why did Ravi Shastri praise the decision to include Varun Chakravarthy in the playing XI?,"1: Ravi Shastri praised the decision to include Varun Chakravarthy in the playing XI because Chakravarthy picked up five wickets for 42 runs, significantly contributing to India's 44-run win over New Zealand. Shastri emphasized that Chakravarthy is a crucial player for getting wickets in the middle overs and noted that his current form, self-confidence, and ability make him an ideal choice, especially against teams that have not seen much of him."
 What strategy does Ravi Shastri suggest India employ for their semifinal match against Australia?,"2: Ravi Shastri suggests that India should retain the same playing XI for their semifinal match against Australia. He argues that the short turnaround time and the condition of the pitch, which is slightly worn and favorable to spinners, necessitate sticking with the current team to maintain momentum and effectiveness."
 How does Varun Chakravarthy's approach to constructing an over differ between T20s and ODIs?,"1: Varun Chakravarthy constructs an over differently in T20s compared to ODIs by varying the sequencing of his deliveries. In T20s, he adapts his ball sequencing to suit the shorter format, focusing on strategic variations such as inward, outward, straighter, and topspin deliveries, while in ODIs, he sequences his deliveries differently to suit the 50-over format. His experience in tournaments like the Vijay Hazare Trophy has helped him understand when to use each type of delivery effectively in ODIs."
" What does Varun Chakravarthy say about the assistance from the pitch during the match against New Zealand, and how does it affect his bowling strategy?","2: Varun Chakravarthy mentioned that although the pitch at the Dubai International Cricket Stadium offered some assistance for spinners, it was not as much of a rank turner as projected. The pitch was holding and deviating slightly, creating doubts for the batsmen. In such conditions, he emphasized the importance of patience, as the ball doesn’t turn quickly on slow wickets. He dedicated his five wickets to the other bowlers for their supportive bowling, which played a role in his success."
 What were Varun Chakravarthy's initial career dreams before he took up cricket?,"1: Before taking up cricket, Varun Chakravarthy's dreams were to be an architect and make movies."
" How did Varun Chakravarthy perform in his second one-day international match against New Zealand, and what did he credit for his success?","2: In his second one-day international match against New Zealand, Varun Chakravarthy took 5 wickets for 42 runs. He credited his success to the contributions of the other bowlers, whose performance helped him pick up wickets."
 How did India's familiarity with the conditions in Dubai help them during the match against New Zealand?,"1: India's familiarity with the conditions in Dubai helped them in selecting a suitable bowling unit, comprising a spin quartet that included Varun Chakravarthy, Kuldeep Yadav, Ravindra Jadeja, and Axar Patel. This familiarity allowed them to play to the conditions effectively, putting constant pressure on New Zealand. The spin bowlers, especially Varun Chakravarthy, were able to read the situation well, contributing significantly to India's 44-run victory."
" What was Matt Henry's perspective on New Zealand's bowling strategy against India, and how does he plan to use this experience in future matches?","2: Matt Henry expressed that New Zealand pacers were successful in putting pressure on India early by adapting and reading the conditions to force India into making tough scoring options. He highlighted the importance of taking wickets throughout the game, particularly in the middle overs, to impact the game's back end. Henry plans to apply the insights and learnings from the match against India to their future semifinal match against South Africa in Lahore, aiming to continue exerting pressure and taking wickets consistently."
 What factors make Varun Chakravarthy a challenging bowler to face according to Axar Patel?,"1: According to Axar Patel, Varun Chakravarthy is a challenging bowler to face because it is very difficult for batters to read his deliveries from his hand. Additionally, the pace at which Chakravarthy bowls is also problematic for batters. If a batter misses the line, there is a higher chance of getting out because he is fast in the air."
 How has Axar Patel adapted his batting approach in recent matches for India?,"2: Axar Patel has adapted his batting approach by playing based on the situation and the team’s requirements. Unlike before, when he had to score quickly at lower positions, now he has more time and can play accordingly since there are more batsmen behind him. This approach was evident when he formed a solid 98-run stand with Shreyas Iyer against New Zealand after coming in at a challenging position."
 What was the contribution of Shreyas Iyer in the match discussed by Ambati Rayudu?,"1: Shreyas Iyer played a crucial innings for India after the top order failed, scoring 79 runs in a partnership of 98 runs with Axar Patel for the fourth wicket. His performance was highlighted for showing the importance of a No. 4 batsman in stabilizing the team's innings and handling challenging conditions effectively."
" How did Shreyas Iyer handle the challenging pitch during his innings, as per Ambati Rayudu’s comments?","2: According to Ambati Rayudu, Shreyas Iyer batted with remarkable ease on the challenging pitch. He effectively handled short balls, played spin beautifully using the crease and angles to his advantage, and picked up the pace of the ball better than many others in the Indian lineup. His ability to curb his aggressive instincts and adapt to the conditions was praised."
 Why was Cooper Connolly included in Australia's Champions Trophy squad?,"1: Cooper Connolly was included in Australia's Champions Trophy squad as a replacement for injured opener Matt Short, who was ruled out due to a quad injury. Connolly was initially named as a travelling reserve for the tournament before being officially added to the squad."
 How might Cooper Connolly's skills benefit the Australian team in the Champions Trophy?,"2: Cooper Connolly's skills as a spin-bowling allrounder could benefit the Australian team by providing an additional bowling option. With Australia potentially facing a shortage of bowlers, his left-arm spin could be a valuable asset, especially in the conditions expected in Dubai."
 How did Varun Chakravarthy contribute to India's victory against New Zealand in the ICC Champions Trophy match?,"1: Varun Chakravarthy played a crucial role in India's victory against New Zealand by taking a five-wicket haul. Coming off the bench, he formed a formidable quartet with other Indian spinners, helping India claim a 44-run win by effectively squeezing New Zealand's batting lineup with spin, especially during the middle overs where the Indian spinners bowled 128 dot balls."
 What strategy did India employ with their spin attack and how did it impact New Zealand's performance in their run chase?,"2: India employed a strategy centered around their spin attack, using four spinners—Varun Chakravarthy, Axar Patel, Kuldeep Yadav, and Ravindra Jadeja—on a slow pitch to apply pressure through dot balls and strategic wicket-taking. This approach effectively restricted New Zealand, who managed to score just over 200 runs, well below their typical scoring in excess of 300 during their recent games in Pakistan. The spinners' performance, especially during the middle overs, played a critical role in securing India's win by building pressure and inducing regular wickets."
 How did Varun Chakravarthy's performance in the Vijay Hazare Trophy contribute to his ODI career for India?,"1: Varun Chakravarthy's experience in the Vijay Hazare Trophy played a significant role in his transition from T20s to ODIs. It helped him understand how to sequence his deliveries differently in the 50-over format compared to T20s. This experience allowed him to figure out when and how to effectively use his variations, such as the incoming and outgoing deliveries, the straighter one, and the top-spin, contributing to his overall sense of awareness of when to bowl specific deliveries in ODIs."
 What strategic dilemma did Varun Chakravarthy’s performance pose for the Indian team management before their clash against Australia?,"2: Varun Chakravarthy's impressive performance created a pleasant dilemma for the Indian team management regarding their bowling strategy. With Varun performing effectively, the Indian team had to decide whether to continue with a four-pronged spin attack or revert to their usual three-two combination of spinners and seamers. This decision involved figuring out which bowler to potentially leave out, as dropping Varun seemed out of the question given his valuable contributions."
" How did Varun Chakravarthy perform in the match against New Zealand, and what was the key moment that led to his consideration for a spot in the semifinal?","1: Varun Chakravarthy impressed with figures of 5/42, significantly enhancing his chances of earning a spot in the semifinal. A key moment that contributed to this was an on-field decision by umpire Michael Gough, where Michael Bracewell was given out LBW despite the ball-tracking later showing it was missing the stumps. Despite this stroke of luck, Varun's overall performance, including his flipper and top spinner variations, made him an outstanding candidate for the semifinal against Australia in Dubai."
" What were the notable fielding moments in the match, and how did they impact the outcome?","2: Glenn Phillips took a stunning catch that left Virat Kohli awestruck, continuing his reputation as a remarkable fielder. His catch was a moment of brilliance that bolstered New Zealand's fielding efforts. In contrast, Varun Chakravarthy's attempt to catch a free hit resulted in an error where he inadvertently kicked the ball towards the boundary, conceding four runs. While Phillips's catch was a highlight, Varun's error showed his improvements in fielding weren't enough to prevent occasional lapses. These fielding moments defined the dynamics on the field and affected the strategic momentum for both teams."
 What was the significance of Varun Chakravarthy's performance in the ICC Champions Trophy match against New Zealand?,"1: Varun Chakravarthy's performance was significant as he delivered a player-of-the-match performance, picking up 5/42. His success against New Zealand made a compelling case for his inclusion in the playing XI for the semifinal against Australia. His ability to offer something unique as a spinner has created a ""good headache"" for the Indian team management in terms of selection for the next game."
" What comments did Ravi Shastri make about Varun Chakravarthy, and why are they important?","2: Ravi Shastri commented that Varun Chakravarthy has made a strong case to be retained in the playing XI for the semifinal against Australia, noting his outstanding performance and the consistency of pitch conditions. Shastri's comments are important as they highlight Varun's potential impact and the challenge he presents for selectors when deciding on the team composition for upcoming matches."
 How did Varun Chakravarthy contribute to India's victory against New Zealand in the Champions Trophy match?,"1: Varun Chakravarthy was instrumental in India's victory against New Zealand, taking 5 wickets for 42 runs. His performance was crucial in helping India restrict New Zealand and secure a 44-run win, which also enabled them to top the Group A table and set up a semifinal match against Australia."
" What challenges did Shreyas Iyer face during his innings against New Zealand, and how did he overcome them?","2: Shreyas Iyer faced the challenge of building India's innings from scratch after a top-order collapse, unlike previous matches where he had the support of a solid start from the top three batters. He successfully navigated the pressure by crafting a composed fifty under challenging circumstances, scoring 79 off 98 balls. Iyer formed a crucial 98-run partnership with Axar Patel and showcased his natural flair, which included a six off pacer Will O’Rourke, helping stabilize the innings on a slow pitch."
 How did the New Zealand seamers manage to perform well on a spin-friendly track against India?,"1: The New Zealand seamers, particularly Matt Henry, Kyle Jamieson, and Will O’Rourke, managed to perform well on a spin-friendly track by effectively using their height and movement. Despite the conditions not being pace-friendly, Henry troubled the Indian batsmen with movement in the air and off the pitch and picked up a crucial wicket by keeping the ball on a good length. Jamieson used his height to generate unexpected bounce and slower pace, which led to multiple breakthroughs. Their disciplined bowling, complemented by an exceptional fielding effort from Glenn Phillips and Kane Williamson, restricted India to a lower total than expected on the surface."
 How was India able to counter New Zealand’s spinners effectively despite the challenging pitch?,"2: India countered New Zealand’s spinners effectively by adopting a strategy focused on strike rotation instead of attempting aggressive strokes. This approach allowed them to maintain a steady run rate of 5.12 over 25 overs against spinners Mitchell Santner, Michael Bracewell, and Rachin Ravindra. By limiting dot balls to 66 during this period with only managing six boundaries and three sixes against the spinners, India was able to post a respectable total despite the challenging pitch conditions."
 What is the key weakness in Shubman Gill's batting technique that Matt Henry and other bowlers have exploited?,"1: The key weakness in Shubman Gill's batting technique is his slow weight transfer onto the front foot. This is exacerbated by his tendency to take a small stride rather than a substantial step forward, making him susceptible to deliveries pitched at an in-between length, around 6 to 8 meters from the stumps. Bowlers like Matt Henry exploit this weakness by delivering balls that skid and trap him in front as he struggles to transfer his weight forward effectively."
 How has Shubman Gill attempted to manage his weakness with weight transfer while batting?,"2: Shubman Gill has attempted to manage his weakness in weight transfer by using his hands skillfully to play strokes even when his weight isn't properly transferred forward. He often leads with his hands, allowing them to meet the ball in front of his body, which works especially well on pitches with bounce. Additionally, he has tried to reduce his initial back-foot movement and has experimented with a more pronounced front shoulder lean. In recent months, he has also adopted the strategy of walking down the track against bowlers who target the problematic length to disrupt their length and gain balance."
" What were some key mistakes Kerala made during the Ranji Trophy final against Vidarbha, and how did these affect their chances of winning?","1: Kerala made several key mistakes during the Ranji Trophy final, which affected their chances of winning. Firstly, they provided Vidarbha with favorable batting conditions after winning the toss, which could have given their opponents an early advantage. Additionally, Kerala had defensive field placements throughout the game, which may have limited their ability to put pressure on Vidarbha's batsmen. Individual errors also played a crucial role, such as Sachin Baby's ill-timed slog-sweep two runs short of his century, which shifted the game's momentum, and Akshay Chandran dropping a crucial catch of centurion Karun Nair. These mistakes highlighted tactical naivety and unseized moments, ultimately contributing to their loss."
 How can Kerala improve and shine in future Ranji Trophy tournaments according to the article?,"2: To improve and shine in future Ranji Trophy tournaments, Kerala can focus on several strategic areas. They need to develop top-order batsmen who can consistently score centuries, providing a stronger platform for middle-order players like Salman Nizar and Mohammed Azharuddeen. Grooming young talents such as Eden Apple Tom as a future strike bowler and finding a reliable spinner who can perform across various conditions are also on the priority list. Investing in youth development and infrastructure will aid Kerala's goal of becoming a progressing side, rather than a one-season wonder. Learning from Vidarbha's rise from underdogs to champions can provide Kerala with a roadmap for success."
 How did Glenn Phillips manage to make such stunning catches in the Champions Trophy match against India?,"1: Glenn Phillips attributes his stunning catches to a combination of luck, hard work, and mastering the basics. Despite joking about not using a special glue, he admits to having sweaty palms and relies on his skills and good fortune. During the Champions Trophy match against India, Phillips made a breathtaking catch off Virat Kohli's powerful square cut, diving like an eagle to snatch the ball from behind his right shoulder."
 What role did Kane Williamson play in restricting India to 249/9 in the Champions Trophy match?,"2: Kane Williamson played a vital role in New Zealand’s fielding effort against India by taking crucial catches that helped restrict them to 249/9. He notably cut off a hard-hit slash at point by Hardik Pandya and took a stunning full-length diving catch to send back Ravindra Jadeja. Despite facing a powerful strike that jolted him on one occasion, Williamson's excellent fielding significantly contributed to the pressure on the Indian batting lineup."
 What issue does Sir Vivian Richards raise regarding the scheduling of the ICC Champions Trophy?,"1: Sir Vivian Richards raises concerns about the confusion and fairness of the ICC Champions Trophy schedule, particularly the requirement for both Australia and South Africa to travel to Dubai to know their semifinal opponents. He questions why the ICC, as the governing body of cricket, is allowing such a scheduling issue and demands an explanation about the decision-making process. Richards highlights the importance of sports in uniting people and expresses his disappointment over the logistical confusion potentially caused by political factors."
 Why do former England cricketers believe that India has an advantage in the ICC Champions Trophy?,"2: Former England cricketers Nasser Hussain and Michael Atherton believe that India has an advantage in the ICC Champions Trophy because they do not have to travel to other venues; all of their matches are scheduled in Dubai. This fixed location allows the Indian team to avoid the fatigue and logistical challenges associated with constant travel, potentially providing them with a better chance to perform well in the tournament."
 What does Sir Vivian Richards suggest the West Indies cricket team should do to improve their performance in ODI cricket?,"1: Sir Vivian Richards suggests that the West Indies cricket team should learn from Afghanistan by emulating their passion, energy, and fighting spirit in the game. He highlights the importance of learning and gaining experience over the years which has helped Afghanistan become a competitive force in international cricket."
 What does Sir Vivian Richards identify as necessary changes within West Indies cricket to regain their former status?,"2: Sir Vivian Richards identifies that improving West Indies cricket will require not just player effort but also actions from individuals in responsible positions, such as the cricket board. He stresses the need for these individuals to identify and address the issues that have prevented the team from performing well in major tournaments like the Champions Trophy."
